descricao_original;agrupamento;id_linha_origem;valor_total;quantidade;uf_solicitante;municipio_solicitante;centro_custo;data_compra
Locação de motoniveladora 140K com operador para terraplanagem;Locação de Equipamentos;MAT-0001;125000.00;1;BA;Salvador;CC-001;2026-04-15
Manutenção preventiva em transformador de potência 138kV;Manutenção Industrial;MAT-0002;87500.00;1;MG;Belo Horizonte;CC-002;2026-04-20
Cabo de alumínio nu CAA 4/0 AWG (Penguin) para linha de transmissão;Materiais Elétricos;MAT-0003;42300.00;500;PE;Recife;CC-003;2026-04-22
Serviço de coleta de resíduos industriais classe II perigosos;Resíduos & Meio Ambiente;MAT-0004;15800.00;1;RJ;Rio de Janeiro;CC-001;2026-04-25
Bomba centrífuga horizontal 50CV inox 304 para água tratada;Equipamentos Industriais;MAT-0005;67200.00;2;SP;São Paulo;CC-004;2026-04-28
